{
  "schema_version": "intelligence-evaluation/v1",
  "activation_gate": "PRE_G0_CONTRACT_ONLY",
  "human_oversight_standard_ref": "human-oversight:canonical:v1",
  "hard_bans": {
    "numeric_scoring": "DISALLOWED",
    "ranking": "DISALLOWED",
    "automated_employment_decision": "DISALLOWED",
    "affect_emotion_inference": "DISALLOWED",
    "personality_inference": "DISALLOWED",
    "deception_inference": "DISALLOWED",
    "protected_attribute_optimization": "DISALLOWED",
    "provenance_sole_adverse_action": "DISALLOWED",
    "autonomous_mutation": "DISALLOWED",
    "batch_approval": "DISALLOWED"
  },
  "max_pending_proposals": 5,
  "proposal_ttl_hours": 168,
  "capabilities": [
    {
      "capability_id": "capability:qoh:v1",
      "kind": "QOH",
      "lifecycle": "RESEARCH_ONLY",
      "synthetic": true,
      "metric_protocol": {
        "state": "DESIGNED",
        "metric_kind": "OUTCOME_ASSOCIATION",
        "cohort_origin": "SYNTHETIC",
        "contains_raw_pii": false,
        "contains_raw_protected_attributes": false,
        "protected_attribute_access": "NONE",
        "cohort_definition_ref": "cohort:qoh:synthetic",
        "minimum_sample_size_defined": false,
        "observed_sample_size": 0,
        "ground_truth_owner": "UNASSIGNED",
        "missingness_plan_ref": "missingness:qoh:v1",
        "confounder_plan_refs": ["confounder:qoh:v1"],
        "uncertainty_method": "NOT_DEFINED",
        "provenance_chain_ref": "provenance:qoh:synthetic"
      },
      "policy": {
        "output_mode": "AGGREGATE_EVIDENCE",
        "individual_action_scope": "NO_INDIVIDUAL_ACTION",
        "human_screening_only": false,
        "four_fifths_indicator_role": "NOT_APPLICABLE",
        "deepfake_signal_role": "NOT_APPLICABLE",
        "citation_required": false,
        "ontology_provenance_required": false,
        "human_review_required": true,
        "appeal_required": true,
        "rollback_required": true,
        "produces_decision": false,
        "numeric_scoring": "DISALLOWED",
        "ranking": "DISALLOWED",
        "automated_employment_decision": "DISALLOWED",
        "affect_emotion_inference": "DISALLOWED",
        "personality_inference": "DISALLOWED",
        "deception_inference": "DISALLOWED",
        "protected_attribute_optimization": "DISALLOWED",
        "provenance_sole_adverse_action": "DISALLOWED",
        "autonomous_mutation": "DISALLOWED",
        "batch_approval": "DISALLOWED"
      },
      "gates": [
        { "kind": "EVIDENCE", "status": "NOT_MET" },
        { "kind": "LEGAL", "status": "NOT_MET" },
        { "kind": "INDEPENDENT_AUDIT", "status": "NOT_MET" },
        { "kind": "OWNER", "status": "NOT_MET" }
      ],
      "evidence_verified": false,
      "legal_review_verified": false,
      "independent_audit_verified": false,
      "owner_accepted": false,
      "full_ats_accepted": false,
      "proposal_generation_allowed": false,
      "human_action_allowed": false,
      "production_eligible": false
    },
    {
      "capability_id": "capability:fairness:v1",
      "kind": "FAIRNESS",
      "lifecycle": "EVIDENCE_REQUIRED",
      "synthetic": true,
      "metric_protocol": {
        "state": "DESIGNED",
        "metric_kind": "SELECTION_RATE_SCREENING",
        "cohort_origin": "SYNTHETIC",
        "contains_raw_pii": false,
        "contains_raw_protected_attributes": false,
        "protected_attribute_access": "AUDIT_ONLY_AGGREGATED",
        "cohort_definition_ref": "cohort:fairness:synthetic",
        "minimum_sample_size_defined": false,
        "observed_sample_size": 0,
        "ground_truth_owner": "UNASSIGNED",
        "missingness_plan_ref": "missingness:fairness:v1",
        "confounder_plan_refs": ["confounder:fairness:v1"],
        "uncertainty_method": "NOT_DEFINED",
        "provenance_chain_ref": "provenance:fairness:synthetic"
      },
      "policy": {
        "output_mode": "SCREENING_INDICATOR",
        "individual_action_scope": "NO_INDIVIDUAL_ACTION",
        "human_screening_only": true,
        "four_fifths_indicator_role": "SCREENING_ONLY",
        "deepfake_signal_role": "NOT_APPLICABLE",
        "citation_required": false,
        "ontology_provenance_required": false,
        "human_review_required": true,
        "appeal_required": true,
        "rollback_required": true,
        "produces_decision": false,
        "numeric_scoring": "DISALLOWED",
        "ranking": "DISALLOWED",
        "automated_employment_decision": "DISALLOWED",
        "affect_emotion_inference": "DISALLOWED",
        "personality_inference": "DISALLOWED",
        "deception_inference": "DISALLOWED",
        "protected_attribute_optimization": "DISALLOWED",
        "provenance_sole_adverse_action": "DISALLOWED",
        "autonomous_mutation": "DISALLOWED",
        "batch_approval": "DISALLOWED"
      },
      "gates": [
        { "kind": "EVIDENCE", "status": "NOT_MET" },
        { "kind": "LEGAL", "status": "NOT_MET" },
        { "kind": "INDEPENDENT_AUDIT", "status": "NOT_MET" },
        { "kind": "OWNER", "status": "NOT_MET" }
      ],
      "evidence_verified": false,
      "legal_review_verified": false,
      "independent_audit_verified": false,
      "owner_accepted": false,
      "full_ats_accepted": false,
      "proposal_generation_allowed": false,
      "human_action_allowed": false,
      "production_eligible": false
    },
    {
      "capability_id": "capability:coaching:v1",
      "kind": "COACHING",
      "lifecycle": "PROPOSAL_ONLY",
      "synthetic": true,
      "metric_protocol": {
        "state": "DESIGNED",
        "metric_kind": "CITATION_COVERAGE",
        "cohort_origin": "SYNTHETIC",
        "contains_raw_pii": false,
        "contains_raw_protected_attributes": false,
        "protected_attribute_access": "NONE",
        "cohort_definition_ref": "cohort:coaching:synthetic",
        "minimum_sample_size_defined": false,
        "observed_sample_size": 0,
        "ground_truth_owner": "UNASSIGNED",
        "missingness_plan_ref": "missingness:coaching:v1",
        "confounder_plan_refs": ["confounder:coaching:v1"],
        "uncertainty_method": "NOT_DEFINED",
        "provenance_chain_ref": "provenance:coaching:synthetic"
      },
      "policy": {
        "output_mode": "CITATION_BACKED_PROPOSAL",
        "individual_action_scope": "HUMAN_REVIEWED_PROPOSAL",
        "human_screening_only": false,
        "four_fifths_indicator_role": "NOT_APPLICABLE",
        "deepfake_signal_role": "NOT_APPLICABLE",
        "citation_required": true,
        "ontology_provenance_required": false,
        "human_review_required": true,
        "appeal_required": true,
        "rollback_required": true,
        "produces_decision": false,
        "numeric_scoring": "DISALLOWED",
        "ranking": "DISALLOWED",
        "automated_employment_decision": "DISALLOWED",
        "affect_emotion_inference": "DISALLOWED",
        "personality_inference": "DISALLOWED",
        "deception_inference": "DISALLOWED",
        "protected_attribute_optimization": "DISALLOWED",
        "provenance_sole_adverse_action": "DISALLOWED",
        "autonomous_mutation": "DISALLOWED",
        "batch_approval": "DISALLOWED"
      },
      "gates": [
        { "kind": "EVIDENCE", "status": "NOT_MET" },
        { "kind": "LEGAL", "status": "NOT_MET" },
        { "kind": "INDEPENDENT_AUDIT", "status": "NOT_MET" },
        { "kind": "OWNER", "status": "NOT_MET" }
      ],
      "evidence_verified": false,
      "legal_review_verified": false,
      "independent_audit_verified": false,
      "owner_accepted": false,
      "full_ats_accepted": false,
      "proposal_generation_allowed": false,
      "human_action_allowed": false,
      "production_eligible": false
    },
    {
      "capability_id": "capability:skills:v1",
      "kind": "SKILLS_ONTOLOGY",
      "lifecycle": "PROPOSAL_ONLY",
      "synthetic": true,
      "metric_protocol": {
        "state": "DESIGNED",
        "metric_kind": "ONTOLOGY_PROVENANCE_COVERAGE",
        "cohort_origin": "SYNTHETIC",
        "contains_raw_pii": false,
        "contains_raw_protected_attributes": false,
        "protected_attribute_access": "NONE",
        "cohort_definition_ref": "cohort:skills:synthetic",
        "minimum_sample_size_defined": false,
        "observed_sample_size": 0,
        "ground_truth_owner": "UNASSIGNED",
        "missingness_plan_ref": "missingness:skills:v1",
        "confounder_plan_refs": ["confounder:skills:v1"],
        "uncertainty_method": "NOT_DEFINED",
        "provenance_chain_ref": "provenance:skills:synthetic"
      },
      "policy": {
        "output_mode": "PROVENANCE_BACKED_PROPOSAL",
        "individual_action_scope": "HUMAN_REVIEWED_PROPOSAL",
        "human_screening_only": false,
        "four_fifths_indicator_role": "NOT_APPLICABLE",
        "deepfake_signal_role": "NOT_APPLICABLE",
        "citation_required": false,
        "ontology_provenance_required": true,
        "human_review_required": true,
        "appeal_required": true,
        "rollback_required": true,
        "produces_decision": false,
        "numeric_scoring": "DISALLOWED",
        "ranking": "DISALLOWED",
        "automated_employment_decision": "DISALLOWED",
        "affect_emotion_inference": "DISALLOWED",
        "personality_inference": "DISALLOWED",
        "deception_inference": "DISALLOWED",
        "protected_attribute_optimization": "DISALLOWED",
        "provenance_sole_adverse_action": "DISALLOWED",
        "autonomous_mutation": "DISALLOWED",
        "batch_approval": "DISALLOWED"
      },
      "gates": [
        { "kind": "EVIDENCE", "status": "NOT_MET" },
        { "kind": "LEGAL", "status": "NOT_MET" },
        { "kind": "INDEPENDENT_AUDIT", "status": "NOT_MET" },
        { "kind": "OWNER", "status": "NOT_MET" }
      ],
      "evidence_verified": false,
      "legal_review_verified": false,
      "independent_audit_verified": false,
      "owner_accepted": false,
      "full_ats_accepted": false,